{
  "slow_k": 0.5,
  "slow_duration": 2.0,
  "knockback_kb_dist": 120.0,
  "knockback_stun": 1.0,
  "poison_dps": 15.0,
  "poison_duration": 4.0,
  "burn_dps": 30.0,
  "burn_splash": 80.0,
  "burn_duration": 3.0,
  "chain_count": 3.0,
  "chain_range": 150.0,
  "armor_break_val": 20.0,
  "armor_break_duration": 3.0,
  "vuln_k": 20.0,
  "vuln_duration": 3.0,
  "conductive_k": 20.0,
  "conductive_duration": 3.0,
  "corrosion_val": 15.0,
  "corrosion_duration": 4.0,
  "corrosion_max_stack": 5.0,
  "infect_radius": 120.0,
  "infect_dot_dps": 15.0,
  "infect_dot_dur": 3.0,
  "headwind_slow": 15.0,
  "headwind_duration": 5.0,
  "headwind_max_stack": 3.0
}